{"type":"config","name":"grimuah check speed on real project (sleepy)","metricName":"check_ms","metricUnit":"ms","bestDirection":"lower"}
{"run":1,"commit":"b82a7ed","metric":522,"metrics":{"biome_ms":264},"status":"checks_failed","description":"baseline: grimuah check on sleepy. biome step is a silent no-op (npx=pnpm dlx fetches wrong biome package, --reporter invalid for biome lint), so the em-dash guard fails and check_ms is pure process overhead.","timestamp":1789109648155,"segment":0,"confidence":null,"asi":{"hypothesis":"baseline reference","root_cause":"check.zig spawns `npx biome lint . --reporter=compact`; npx is pnpm dlx here (~450ms overhead, wrong package); --reporter is a biome ci option so biome exits 1 with stderr output and check reads empty stdout, treating it as clean","check_ms":522,"biome_ms":264,"sleepy_rev":"06a8ef7","next_action_hint":"resolve local node_modules/.bin/biome directly and drop the unsupported --reporter flag so biome actually lints"}}
{"type":"config","name":"grimuah check speed across project sizes (sleepy + 100/1000/5000)","metricName":"check_ms","metricUnit":"ms","bestDirection":"lower"}
{"run":2,"commit":"b82a7ed","metric":2044,"metrics":{"check_sleepy":516,"biome_sleepy":248,"overhead_sleepy":268,"check_100":498,"biome_100":68,"overhead_100":430,"check_1000":505,"biome_1000":171,"overhead_1000":334,"check_5000":525,"biome_5000":623,"overhead_5000":0,"biome_ms":1110,"overhead_ms":1032},"status":"checks_failed","description":"baseline: multi-size workload (sleepy + 100/1000/5000). npx overhead ~430ms per check dominates; biome step is a silent no-op so the integration guard fails.","timestamp":1789109861248,"segment":1,"confidence":null,"asi":{"biome_ms":1110,"check_ms":2044,"hypothesis":"baseline under multi-size workload","next_action_hint":"apply local-biome resolution fix","overhead_ms":1032,"root_cause":"npx=pnpm dlx adds ~430ms per invocation and fetches the wrong biome package; --reporter invalid makes the step a no-op","sleepy_rev":"06a8ef7"}}
{"run":3,"commit":"43f8e7e","metric":1172,"metrics":{"check_sleepy":276,"biome_sleepy":252,"overhead_sleepy":24,"check_100":73,"biome_100":69,"overhead_100":4,"check_1000":178,"biome_1000":171,"overhead_1000":7,"check_5000":645,"biome_5000":626,"overhead_5000":19,"biome_ms":1118,"overhead_ms":54},"status":"keep","description":"resolve project-local biome instead of npx; drop unsupported --reporter flag; return stderr diagnostics. biome now actually lints. check_ms 2044 -> 1172, overhead 1032 -> 54, guards pass.","timestamp":1789109898423,"segment":1,"confidence":null,"asi":{"check_ms":1172,"fix":"resolve local node_modules/.bin/biome (walk up), fallback PATH biome then npx; drop invalid --reporter flag; return biome stderr diagnostics","hypothesis":"local biome resolution removes npx overhead and makes the lint step real","next_action_hint":"remaining overhead is 54ms total; biome floor is 1118ms. try exec'ing the native biome binary to skip the node shim, and overlap pre-passes with the biome process","overhead_ms":54,"verified":"biome integration guard passes (throw flagged by plugin); e2e + unit tests pass"}}
{"run":4,"commit":"2b23b2a","metric":1037,"metrics":{"check_sleepy":238,"biome_sleepy":251,"overhead_sleepy":0,"check_100":38,"biome_100":70,"overhead_100":0,"check_1000":142,"biome_1000":172,"overhead_1000":0,"check_5000":619,"biome_5000":627,"overhead_5000":0,"biome_ms":1120,"overhead_ms":0},"status":"keep","description":"exec biome's native platform binary directly (hoisted or pnpm store), skipping node shim startup. check_ms 1172 -> 1037. guard/e2e/unit all pass.","timestamp":1789109987067,"segment":1,"confidence":7.45925925925926,"asi":{"check_ms":1037,"fix":"resolve @biomejs/cli-<platform>-<arch> native binary (hoisted or pnpm .pnpm store), fallback to shim/PATH/npx","hypothesis":"exec the native biome binary directly to skip the node shim (~40ms per invocation)","next_action_hint":"update measure.sh to use the native binary as the biome floor so overhead_ms is meaningful; then attack prepass cost (overhead is now the only grimuah-owned cost)","overhead_ms":0,"verified":"e2e + unit tests + biome integration guard pass"}}
{"run":5,"commit":"6037309","metric":1005,"metrics":{"check_sleepy":220,"biome_sleepy":214,"overhead_sleepy":6,"check_100":38,"biome_100":36,"overhead_100":2,"check_1000":143,"biome_1000":137,"overhead_1000":6,"check_5000":604,"biome_5000":589,"overhead_5000":15,"biome_ms":976,"overhead_ms":29},"status":"keep","description":"consolidate four per-surface pre-passes into a single walk with one file read each. overhead_ms 60 -> 29, check_ms 1044 -> 1005. checks pass.","timestamp":1789110130339,"segment":1,"confidence":12.44311377245509,"asi":{"check_ms":1005,"fix":"merge 4 per-surface checks (suffix, firewall, innate depth, singleton) into one walk per surface with a single file read; 33 walks -> 9","hypothesis":"pre-pass walks 33 trees and reads files twice; one walk per surface halves grimuah-owned overhead","next_action_hint":"remaining overhead ~29ms across 4 repos. overlap pre-pass with the biome subprocess to hide it","overhead_ms":29,"verified":"unit tests + e2e + biome integration guard pass"}}
{"run":6,"commit":"b2a0249","metric":984,"metrics":{"check_sleepy":214,"biome_sleepy":220,"overhead_sleepy":0,"check_100":37,"biome_100":36,"overhead_100":1,"check_1000":138,"biome_1000":136,"overhead_1000":2,"check_5000":595,"biome_5000":591,"overhead_5000":4,"biome_ms":983,"overhead_ms":7},"status":"keep","description":"overlap pre-passes with the biome subprocess: spawn biome first, run pre-passes, then drain its pipes. overhead_ms 29 -> 7, check_ms 1005 -> 984, now at the biome floor.","timestamp":1789110260744,"segment":1,"confidence":20,"asi":{"check_ms":984,"fix":"spawn biome via std.process.spawn first, run pre-passes while it works, then drain stdout/stderr with MultiReader and wait","hypothesis":"overlap the pre-pass with the biome subprocess to hide grimuah-owned work under biome's runtime","next_action_hint":"check_ms is now at the biome floor (984 vs 983); only biome's own cost remains. verify robustness across layouts and stop unless a new lever appears","overhead_ms":7,"verified":"e2e (90+ checks incl. async spawn) + unit tests + biome integration guard pass"}}
{"type":"config","name":"grimuah check speed: 12 sizes + 17 fuzzed error/warning repos + sleepy","metricName":"check_ms","metricUnit":"ms","bestDirection":"lower"}
{"run":7,"commit":"e6d7a89","metric":17464,"metrics":{"biome_ms":60038,"overhead_ms":2565,"check_sleepy":530,"check_size_100":512,"check_size_1000":561,"check_size_5000":985,"check_fuzz_08":620},"status":"checks_failed","description":"baseline under realistic files: npx biome no-op so check_ms (17464) is far below the real biome floor (60038). checks fail (integration guard). not a valid speed reference.","timestamp":1789110807240,"segment":2,"confidence":null,"asi":{"biome_ms":60038,"check_ms":17464,"files":"synthetic files now realistic (~80 lines/file, was ~2.7); size-100 = 8084 lines/165ms vs sleepy 21376 lines/196ms","hypothesis":"baseline reference under realistic workload","next_action_hint":"restore the biome fix; expect check_ms to rise toward the 60s biome floor because baseline did no linting","overhead_ms":2565,"sleepy_rev":"06a8ef7","warning":"baseline check_ms is a no-op: npx biome never linted, so it is NOT a valid speed reference. any passing run now does real work."}}
{"run":8,"commit":"b27bac3","metric":60606,"metrics":{"biome_ms":60874,"overhead_ms":410,"check_sleepy":227,"check_size_100":189,"check_size_1000":1710,"check_size_5000":8413,"check_fuzz_08":3679},"status":"keep","description":"restore biome fix, measure on realistic files. check_ms 60606 vs floor 60874 (overhead 410ms, 0.67%). size-100=189ms matches sleepy's 227ms range. checks pass. NOTE: higher than the 17464 no-op baseline because it now does real linting.","timestamp":1789111002364,"segment":2,"confidence":null,"asi":{"check_ms":60606,"comparison_note":"baseline 17464 was a no-op (npx biome never linted); 17464 and 60606 are not comparable. the meaningful floor is biome_ms=60874, grimuah adds 410ms (0.67%)","hypothesis":"with realistic files the tool's true cost shows: check should sit just above the biome floor","next_action_hint":"remaining tool cost is 410ms/30 repos, mostly import scanning. optimize extractImports only if further gains are wanted","overhead_ms":410,"realism":"size-100 = 100 files/8084 lines/189ms vs sleepy 140 files/21376 lines/227ms","verified":"unit + e2e + both biome guards pass"}}
{"run":9,"commit":"5cc3526","metric":24628,"metrics":{"biome_ms":24213,"overhead_ms":559,"check_sleepy":221,"check_size_100":86,"check_size_1000":697,"check_size_5000":3340,"check_fuzz_08":1408},"status":"keep","description":"split GritQL rules one-per-file and drop the no-op structural plugin: check_ms 60606 -> 24628, biome_ms 60874 -> 24213 (2.5x). biome prunes plugin matching per plugin file by root node kind; nine distinct patterns in one top-level `or {}` defeated that pruning. one rule per file (14 files) keeps it. gen-bench now scaffolds .grimuah-rules + biome.json via `grimuah init` so the bench runs the rule layout grimuah actually ships (sleepy keeps its own unchanged rules: check_sleepy 221).","timestamp":1789112753049,"segment":2,"confidence":1,"asi":{"hypothesis":"biome's cost is dominated by GritQL plugin matching, and biome prunes per plugin file; restructuring the rules into one file per rule should cut the biome floor without changing any diagnostic","root_cause":"biome prunes plugin matching by the root node kind of each plugin FILE. a top-level `or { A, B, ... }` with distinct patterns defeats that pruning: on repo-size-250, or{8} distinct = 243ms vs the same 8 patterns in separate files = 147ms (no plugins = 90ms). or{9} with nine IDENTICAL cheap patterns = 98ms, so the cost is pattern diversity inside the wrapper, not the wrapper itself","fix":"src/gritql.zig now emits one .grit plugin file per rule (14 total: cosmetic-em-dash, 9 resilience-*, 4 behavioural-*) and init.zig generates the biome.json plugins list from that table. structural.grit is gone: its only pattern was `undefined` where {} (biome rejects a pattern-less plugin file), it enforced nothing (structural is CLI pre-passes) and cost 745ms on 5000 files","bench_change":"gen-bench.sh scaffolds .grimuah-rules + biome.json via `grimuah init` in a scratch dir instead of copying sleepy's frozen copies; architecture.config.json and node_modules still come from sleepy, and sleepy itself still runs its own unchanged rules (check_sleepy 221-229 across runs). the synthetic repos now run what grimuah scaffolds, which is the point of the bench","semantics":"patterns, messages and spans are unchanged; errors are identical. verified by diffing `biome lint --reporter=json --max-diagnostics=none` over a repo with every rule violated: 10 plugin errors + 2 built-in errors identical in both layouts. splitting surfaces ONE extra plugin warning on `catch {}` (a bare catch matches both the bare-catch error and the silent-catch warn) because `or {}` is first-match-wins while separate plugin files report every matching pattern. this is invisible in grimuah output: biome exits 0 on warnings, and collectBiome discards stderr when the exit code is 0","migration":"generateRules now also rewrites biome.json's plugins array from the legacy per-layer list to the per-rule list, and only when the array is exactly the legacy four; user-added plugins and every other setting survive (pure migrateBiomeJson + unit tests)","ruled_out":"multi-process splitting: biome already saturates all 20 cores (5000 files: 8.4s on 20 cores, 8.4s with 16 concurrent processes on disjoint file lists, 64s on 1 core). per-plugin `includes` scoping and newer-biome flags were not applicable","verification":"zig build test, test-e2e.sh (now asserts one plugin per rule file, no `or {` blocks, every declared plugin exists, each .grit compiles), biome-integration.sh and biome-error-count.sh all pass","next_action_hint":"biome_ms is now 24213ms across 30 repos and overhead is 559ms; remaining levers are small (native binary startup ~30ms/run, daemon). sleepy still pays the old layout because its rules are frozen; an upgrade migration is the only way it would pick up the new one"}}
{"run":10,"commit":"0e1f2b0","metric":25622,"metrics":{"biome_ms":25229,"check_fuzz_08":1468,"check_size_100":91,"check_size_1000":723,"check_size_5000":3661,"check_sleepy":235,"overhead_ms":796},"status":"discard","description":"verification rerun, no code change: check_ms 25622 / biome_ms 25229, both +4.2% vs run 9 (24628/24213), so the machine was ~4% slower this pass and run 9's 2.5x stands. harness metric is noise-limited at ~+/-4%; all remaining biome levers measured this session are dead ends (threads, plugin load, plugin count, sequential, run splitting) and are recorded in .auto/ideas.md","timestamp":1789113367979,"segment":2,"confidence":1.7563128217700417,"asi":{"hypothesis":"verification rerun: run 9's 2.5x (check_ms 24628, biome_ms 24213) is reproducible and not a one-off machine state","result":"check_ms 25622, biome_ms 25229 -- both +4.2% over run 9 with no code change. biome_ms moving by the same factor as check_ms proves the machine was simply ~4% slower this pass (thermal/background load), not that anything regressed","conclusion":"run 9 stands 2.46x below run 8 (60606 -> 24628) with a consistent biome_ms delta, so the improvement is far above noise. the harness metric is noise-limited at roughly +/-4% (~1000ms), so any future change smaller than that cannot be resolved without repeated runs","lever_space":"exhausted for safe changes. measured this session: plugin load is free (14 plugins on a 1-file project == 0 plugins); cost is ~linear in plugin count (~24ms per rule per 1000 files on repo-size-1000: 0/1/4/7/14 plugins = 331/348/394/479/666ms); no hot rule (each alone 0-46ms); BIOME_THREADS is a wash (3303ms default vs 3270-3523ms across 4/8/12/16/24/32); `sequential{}` panics grit-pattern-matcher on biome 2.5.11 and biome still exits 0; splitting built-in vs plugin runs costs more than the combined run (350+468 vs 692ms). remaining biome time is ~49% GritQL matching, ~32% built-in recommended ruleset, ~18% parse","rollback_reason":"none -- no code change was made; this was a measurement-only rerun. the discard status reflects 'metric unchanged/worse', not a failed change","next_action_hint":"the only remaining path past biome's floor is replacing GritQL for grimuah's own 14 rules with native matching (biome native rules cost ~1.1ms per rule per 1000 files vs ~24ms for GritQL, ~20x). that is a rewrite with real false-positive/coverage risk and a divergence-from-biome liability; not worth attempting without an explicit ask. see .auto/ideas.md dead-ends section"}}
{"run":11,"commit":"0e1f2b0","metric":24724,"metrics":{"biome_ms":24804,"check_fuzz_08":1408,"check_size_100":88,"check_size_1000":664,"check_size_5000":3239,"check_sleepy":230,"overhead_ms":437},"status":"discard","description":"retest of multi-process splitting with the new per-rule layout: no gain (1 process 3207ms vs 2/4/8 processes 3213/3211/3196ms; 1 core 24750ms = 7.7x on 20 threads), so that rejection stands. also measured: non-source files cost nothing (675 vs 679ms), language js no-op, single-file or{14}/any{14} 4x worse than 14 files. no code change; check_ms 24724 is the third sample of the same code (24628 / 25622 / 24724)","timestamp":1789113729084,"segment":2,"confidence":7.977728285077951,"asi":{"changed_assumption":"run 9 changed the plugin cost profile by 2.5x, so previously rejected ideas were retested rather than assumed","conclusion":"check_ms has converged at the GritQL floor. three samples of unchanged code: run 9 24628, run 10 25622, run 11 24724 -- a ~2-4% machine-noise band, so nothing smaller than ~1000ms is resolvable on this box","hypothesis":"multi-process splitting might pay off now that the per-rule layout changed biome's plugin cost profile (the original rejection was measured on the old or{} layout, so its assumption no longer held)","measurements":"repo-size-5000, per-rule layout: 1 process 3207ms; taskset 1 core 24750ms (7.7x on 20 hardware threads, ~55% of 14 physical cores); 2/4/8 concurrent processes over disjoint file lists 3213/3211/3196ms. also: non-source files cost nothing (includes [**] 675ms vs [**/*.ts] 679ms vs [**,\"!.grimuah-rules\"] 676ms -- 14 .grit + 3 json are 68KB of 5.2MB); `language js` header accepted but no effect (687->696ms); single-file `or{14}` 2792ms and `any{14}` 2910ms vs 14 files 686ms, and both drop one plugin diagnostic","next_action_hint":"only remaining path is replacing GritQL for grimuah's 14 rules with native matching: plugin matching is 49% of biome's time and biome's native rules cost ~1.1ms per rule per 1000 files vs ~24ms for GritQL (~20x), so the prize is check_ms ~24.6s -> ~14s (~1.8x). it makes grimuah its own linter for those rules, where any divergence is a silent false negative. needs an explicit user decision; do not start it unprompted. separately, grimuah's generated biome.json is missing sleep's files.includes (dist/.pi/.rpiv), which wastes real work on any project that has built -- zero effect on this bench, so it cannot be kept here","result":"no change, metric unchanged: retest found no gain, so the earlier rejection of multi-process splitting stands with its assumption explicitly retested","retested_dead_ends":"multi-process splitting (still no gain), plus new dead ends recorded in .auto/ideas.md: non-source file exclusion (zero), language js (zero), single-file or/any combinators (4x worse + lossy)","rollback_reason":"none -- measurement-only iteration, no code change"}}
{"run":12,"commit":"5e780c9","metric":14071,"metrics":{"biome_ms":26408,"check_fuzz_08":759,"check_sleepy":249,"check_size_100":71,"check_size_1000":386,"check_size_5000":1676,"overhead_ms":20},"status":"keep","description":"native rule engine: enforce grimuah's 14 GritQL rules in-process (src/lint.zig, TS tokeniser) and run biome with --skip=plugin when biome.json is canonical. check_ms 24724 -> 14071 (1.76x), now below biome_ms 26408 because the plugin engine never runs. sleepy keeps the legacy 4-file layout so it stays on biome's plugins (249ms, unchanged). verified by .auto/native-diff.sh: 30 projects (29 bench repos incl. the 17 fuzz repos + sleepy's sources in a canonical scaffold) plus a 100-file edge-case corpus report identical (file, severity, rule message) findings to biome's plugin engine.","timestamp":1789131104473,"segment":2,"confidence":0.8318215248835499,"asi":{"dead_rules_found":"cosmetic-em-dash, resilience-let and resilience-switch produce ZERO diagnostics in biome 2.5.11 (verified over a 100-file edge-case corpus and sleepy's 210 files, which contain 35 `let`/`switch` sites): the grit patterns never match. they are deliberately not reimplemented so grimuah's observable behaviour is unchanged; fixing them would newly fail currently-passing projects, which is a product decision","divergence_found_and_fixed":"biome's `catch ($err)` pattern does not match a typed parameter, so `catch (e: unknown) { ... }` warns nothing; 6 catches in sleepy/gateway/music-bot.ts exposed it. native now skips bound catch clauses whose parameter has a top-level `:`","hypothesis":"biome's plugin engine charges one full per-file syntax-tree traversal per plugin file (300-900us/file, 64% of biome CPU) whether or not a pattern can match, so moving grimuah's own rules in-process removes most of biome's work","mechanism":"src/lint.zig tokenises JS/TS (comments, strings, templates incl. ${} substitutions, regex vs division, JSX text) and runs 11 checks matching biome 2.5.11's plugin semantics; src/commands/check.zig runs biome with --skip=plugin when biome.json lists exactly grimuah's canonical rule files, otherwise keeps the old plugin path","next_action_hint":"handing off: context window nearly full. run `bash .auto/measure.sh` to reconfirm, then read the handoff under .rpiv/artifacts/handoffs/. follow-ups: the 3 dead rules, sleepy's frozen rule layout (an upgrade migration is the only way it picks up the native path), missing files.includes for dist/.pi/.rpiv in the generated biome.json","verification":".auto/native-diff.sh diffs (file, severity, rule message) between biome's plugin diagnostics and the native engine over 30 projects + the edge corpus; wired into checks.sh. unit tests, 86-check e2e suite and both biome guards pass","warning_semantics":"biome only surfaces plugin diagnostics when it exits non-zero, so a warnings-only project prints nothing. check.zig holds native catch warnings back unless something else already failed, preserving that behaviour","why_below_the_biome_floor":"biome_ms is measured by .auto/measure.sh as the raw `biome lint .` INCLUDING plugins; grimuah no longer asks biome to run plugins, so check_ms < biome_ms is expected from now on and biome_ms is no longer the floor for grimuah's own runs"}}
