{"run":29,"commit":"fe22e79","metric":569,"metrics":{"biome_ms":23717,"check_fuzz_08":26,"check_size_100":6,"check_size_1000":20,"check_size_5000":52,"check_sleepy":2,"overhead_ms":0},"status":"keep","description":"stop the front-end freeing memory the scan reclaims wholesale: four deferred frees per file only poisoned blocks nobody reads. check_ms 613 -> 569 (1.08x); probe measured 1.069x first","timestamp":1789182430719,"segment":2,"confidence":10.754296626352641,"asi":{"cleaned_up":".rules/parity.zig and src/rules/hygiene.zig call the engine's lintContent too; both pass .owned, which is what they already did","equivalence":"the four teardowns only walked memory the region reclaims anyway, so no code observes their absence. output byte-identical on the bench repos, sleepy and the prepass corpus; the unit tests would fail on a leak if the sequential path ever passed .reclaimed","hypothesis":"the worker hands the front-end an arena it resets after every file, and the front-end still frees its token stream, its tree, its walk array and its scope table on the way out. callgrind put the memset those frees trigger at 8.8% of a run on repo-size-250, all of it reclaiming nothing. a first cut of this made the region's own `free` a no-op through a custom Allocator vtable, and measured 0.995x: the fill that costs is on alloc, which the Allocator wrapper does and no backend can avoid","measurements":"check_ms 613 -> 569 (1.08x). paired interleaved A/B over 30 repos (PASSES=3): 1.062x total, size-766 1.12x, size-892 1.06x, uniform elsewhere","next":"memset is still 15% of a run, and it is now the `undefined` fill on every allocation. removing it needs the front-end's hot arrays to bypass std.mem.Allocator, which is a container rewrite rather than a call-site change","probe_first":"before writing the safe version I measured the prize: removing just those four frees in a throwaway build (accepting the leak) gave 1.069x, which is what the real change then delivered","shape":"a new `Teardown = enum { owned, reclaimed }` parameter on engine.lintContent. `owned` keeps every defer; `reclaimed` skips the four top-level frees because the caller resets the region. scope.analyze's own internal frees are untouched, which the probe showed are not the cost","verification":"zig build test 119/119 including the 44,254-file parse sweep, test-e2e.sh, native-diff.sh, hygiene-diff.sh and both biome guards"}}
{"run":30,"commit":"fe22e79","metric":556,"metrics":{"biome_ms":22970,"check_fuzz_08":26,"check_size_100":7,"check_size_1000":20,"check_size_5000":46,"check_sleepy":2,"overhead_ms":0},"status":"keep","description":"answer \"could this word be a declaration\" from a length-and-first-byte bitmap, and hold every name fact in one map instead of four. check_ms 569 -> 556 (1.02x); paired A/B 1.045x combined","timestamp":1789182664897,"segment":2,"confidence":13.302911093627065,"asi":{"equivalence":"all four maps keyed the same declared names, and every key of `reference_names` had already passed the `binding_names` gate, so one map carries every fact the four did. the unit tests pin the behaviours the maps exist for (a name read only in a type position, a name used twice, a name declared twice, an uninitialised let written once), and byte-identical output on the bench repos, sleepy and the prepass corpus confirms the rest","hypothesis":"scope.analyze asked a string hash map about every word token and kept four separate maps for facts about the same keys: which names are declared, which are duplicated, which are referenced. callgrind put the hash maps at 18% of a run","measurements":"check_ms 569 -> 556 (1.02x). paired interleaved A/B over 30 repos: the name filter alone 1.025x, the filter plus the merged map 1.019x on top of the teardown binary (1.045x combined). size-5000 49 -> 46, size-56 1.14x, but the many bench repos under 250 files are startup-dominated and read flat","next":"scope's hash work is now one lookup per reference token and one per binding, so the remaining large items are the parser's 30% and memset's 7.6% (the undefined fill on every allocation, which cannot be removed through std.mem.Allocator)","shape":"`NameFilter` holds the lengths and first bytes of the file's binding names in a 4x u64 bitmap, so a word token that cannot be a declaration is two loads away from being skipped. `NameState{referenced, duplicated}` replaces binding_names, counted_names, shared_names and reference_names. the final per-binding loop also compares name lengths before calling std.mem.eql","verification":"zig build test 119/119 including the 44,254-file parse sweep, byte-identical output against the previous binary on the bench repos, sleepy and the prepass corpus, plus test-e2e.sh, native-diff.sh, hygiene-diff.sh and both biome guards"}}
{"run":31,"commit":"fe22e79","metric":551,"metrics":{"biome_ms":23948,"check_fuzz_08":24,"check_size_100":7,"check_size_1000":20,"check_size_5000":45,"check_sleepy":2,"overhead_ms":0},"status":"keep","description":"hop between the two bytes an import prefix can start with instead of six std.mem.eql calls at every source byte. check_ms 556 -> 551; paired A/B 1.085x","timestamp":1789182890135,"segment":2,"confidence":17.418125643666322,"asi":{"equivalence":"the scan visits the same positions in the same order, including the position it resumes from after a match (the byte after the prefix + 1) and the case where a quote is never closed (the old code fell through to the next byte, not out of the scan). the seven extractImports unit tests cover every prefix shape, single quotes, multiple imports and non-relative imports, and the output is byte-identical on the bench repos, sleepy and the prepass corpus","hypothesis":"the pre-pass reads every file and extractImports asked six std.mem.eql *calls* about every byte of it, so a 3KB source spent ~96k instructions deciding there was nothing there. callgrind put the pre-pass's inlined mem.zig work at 9.9% of a run","measurements":"check_ms 556 -> 551 (1.01x on a noisy sample, but the paired A/B is 1.085x over 30 repos: size-5000 47 -> 44, size-766 1.06x, size-892 1.06x, fuzz-16 1.33x in an earlier probe)","probe_first":"before touching it I measured the prize: a throwaway build with the whole pre-pass disabled gave 1.278x over 7 repos, so the pre-pass is worth 22-28% of the wall despite being 19% of the instructions, because it runs 8 threads beside the scan's 16 on a 14-core box","resurrected_a_discard":"this exact rewrite was measured as neutral in run 15 and written into ideas.md as \"worth re-applying only if the pre-pass ever becomes the critical path\". it is the critical path now: the scan got 4x faster (runs 16-24) and the pre-pass moved onto its own thread (run 19), so its CPU is no longer hidden","shape":"`std.mem.indexOfAnyPos(content, pos, \"fi\")` hops between the only two bytes a prefix can start with, then matchImportPrefix checks the six literal prefixes at that one position. the resume position after a match is preserved exactly","verification":"zig build test 119/119 including the pre-pass's seven extractImports cases and the 44,254-file parse sweep, byte-identical output on the bench repos, sleepy and the prepass corpus, plus test-e2e.sh, native-diff.sh, hygiene-diff.sh and both biome guards"}}
{"run":32,"commit":"fe22e79","metric":462,"metrics":{"biome_ms":23318,"check_fuzz_08":24,"check_size_100":7,"check_size_1000":13,"check_size_5000":43,"check_sleepy":2,"overhead_ms":0},"status":"keep","description":"stop the pre-pass oversubscribing the cores the scan is using: 8 workers beside a 16-worker scan is contention, not throughput. check_ms 551 -> 462 (1.19x); paired A/B 1.148x, and 1 worker measured worse than 2","timestamp":1789183173721,"segment":2,"confidence":20.823025107164728,"asi":{"hypothesis":"the pre-pass starts up to 8 workers on its own thread while the lint scan already runs 16 on a 14-core box, so 24 threads contend for 14 cores and the prepass threads steal the scan's throughput. a probe that disabled the pre-pass entirely measured 1.278x over 7 repos, which put a number on how much the overlap actually costs","measurements":"check_ms 551 -> 462 (1.19x). paired interleaved A/B over 30 repos: 8 workers -> 4 gave 1.149x, 8 -> 2 gave 1.148x, 2 -> 1 gave 0.932x (worse), so 2 is the knee. absolute totals across the four runs: 8 workers 503/518, 4 workers 451/466, 2 workers 438/446, 1 worker 470","portability":"the rule is not \"2 threads\"; it is that the pre-pass is the smaller of two stages that run at the same time, and the scan already saturates the machine. the constant keeps its machine-derived form (min(cores, 2)) so a machine with fewer cores still gets one thread, and a much larger one still does not start a crowd","shape":"max_prepass_workers 8 -> 2. the parallel path, the flat queue and the 64-file gate are unchanged, and below them the pre-pass is now sequential on its own thread for most surfaces, which is what run 19 shipped","verification":"zig build test 119/119 including the 44,254-file parse sweep, byte-identical output on the bench repos, sleepy and the prepass corpus, plus test-e2e.sh, native-diff.sh, hygiene-diff.sh and both biome guards"}}
{"run":33,"commit":"fe22e79","metric":447,"metrics":{"biome_ms":23383,"check_fuzz_08":23,"check_size_100":7,"check_size_1000":14,"check_size_5000":40,"check_sleepy":2,"overhead_ms":0},"status":"keep","description":"replace three hot leaf scans: the em-dash byte compare, the 53-word keyword scan and the identifier byte chain. check_ms 462 -> 447 (1.03x)","timestamp":1789183634192,"segment":2,"confidence":23.21555252387449,"asi":{"equivalence":"both are representation changes with the same answers: the tables are the exact byte sets the comparisons defined, and StaticStringMap holds the same 53 strings. the parser/differential harnesses and the byte-identical output on the bench repos, sleepy and the prepass corpus confirm it","hypothesis":"callgrind line annotation on ts.zig put three leaves at 2.8-3.5% each: the em-dash scan compared 3 bytes at every offset of every file, isNonReference scanned all 53 keywords with a length compare each (~424 instructions per call), and isIdentifierStart was a five-comparison chain asked once per identifier byte","measurements":"check_ms 462 -> 447 (1.03x). paired interleaved A/B over 30 repos: 1.033x for all three; the em-dash change alone was 1.021x over 8 repos at PASSES=7. instructions are not wall time here: these leaves overlap with memory latency, so 8% of the instruction count bought 3% of the wall","reverted":"a companion sweep over the rules (checkNullLiteral and checkDoubleEquals calling std.mem.eql directly instead of the inline Token.isWord/isPunct, which carry a length pre-check) measured 0.998x, i.e. nothing. it was not kept","shape":"checkEmDash hops on indexOfScalarPos(em_dash[0]) instead of indexOfPos on a 3-byte needle; isIdentifierStart/isIdentifierContinue are 256-entry comptime tables; isNonReference is a comptime StaticStringMap over the same word list","verification":"zig build test 119/119 including the 44,254-file parse sweep, byte-identical output on the bench repos, sleepy and the prepass corpus, plus test-e2e.sh, native-diff.sh, hygiene-diff.sh and both biome guards"}}
{"run":34,"commit":"fe22e79","metric":466,"metrics":{"biome_ms":26833,"check_fuzz_08":23,"check_size_100":6,"check_size_1000":14,"check_size_5000":48,"check_sleepy":2,"overhead_ms":0},"status":"keep","description":"drop the 256KB per-thread alternate signal stack std.Thread allocates: its TLS zeroing was 6.05M instructions per run. paired A/B 1.120x; harness samples were taken while biome_ms drifted +15%","timestamp":1789184028282,"segment":2,"confidence":27.314606741573034,"asi":{"deterministic_evidence":"callgrind on repo-size-250 (instruction counts, no machine noise): 180,154,177 before, 174,098,964 after, i.e. 6,055,213 instructions removed (3.4%), and memset fell from 17.37M to 11.29M. the removed work is exactly the per-thread TLS zeroing of a 256KB block","harness_note":"both `measure.sh` samples after this change read worse than 447 (454, then 466), but the machine was drifting upward through the window: the control measurement `biome_ms` went 23,383 -> 25,712 -> 26,833 in the same three runs, so those samples compare this binary against a faster machine state, not against the code. the paired A/B alternates both binaries per repo and is the arbiter this repo uses for small effects; it reads 1.120x","hypothesis":"std.Thread gives every spawned thread a 256KB thread-local alternate signal stack (std.Options.signal_stack_size defaults to 1<<18), and the thread's TLS setup zeroes the whole block before the thread runs a line. a check starts 16 scan workers plus a pre-pass thread, so 17 x 256KB was being zeroed per run. callgrind attributed 6.13M instructions (3.4%) to memset from tls.prepareArea, and readelf showed .tbss at 0x4001c","measurements":"paired interleaved A/B over 30 repos (PASSES=3): 1.120x. size-5000 47 -> 43, size-892 1.18x, sleepy 2 -> 1ms. the wall gain is larger than the instruction share because the 256KB block is also first-touched per thread, which callgrind does not count","shape":"`pub const std_options: std.Options = .{ .signal_stack_size = null };` in src/main.zig. readelf confirms .tbss drops from 0x4001c (262,172 bytes) to 0x1c (28 bytes)","trade_off":"the alternate signal stack exists so a stack-overflow fault can be reported from outside the overflowing stack. without it a worker that overflows its stack still crashes the process with a non-zero exit, but without the 'stack overflow' trace. it does not change what gets linted or what a clean project sees, and the lint workers do not recurse","verification":"zig build test 119/119 including the 44,254-file parse sweep, byte-identical output on the bench repos, sleepy and the prepass corpus, plus test-e2e.sh, native-diff.sh, hygiene-diff.sh and both biome guards"}}
