{"run":20,"commit":"fe22e79","metric":1195,"metrics":{"biome_ms":25781,"check_fuzz_08":64,"check_size_100":10,"check_size_1000":34,"check_size_5000":144,"check_sleepy":3,"overhead_ms":0},"status":"keep","description":"stop lexing every file twice: ts.parse built its own token stream, so the engine's tokenise and the parse's tokenise were the same lex run over the same bytes. parseTokens takes the stream the engine already has. check_ms 1540 -> 1195 (1.29x); the parse's own share of the front-end CPU fell 1200ms -> 445ms on 5000 files","timestamp":1789164832242,"segment":2,"confidence":1.4673280721533257,"asi":{"hypothesis":"ts.parse called tokenize() itself, so every file was lexed twice: once for the token rules and once inside the parse. passing the token stream the engine already built into the parse removes a whole lex pass","measurements":"check_ms 1540 -> 1195 (1.29x). paired interleaved A/B over 9 repos: 1.304x, uniform 1.17x-1.35x (size-5000 205 -> 158, size-3900 166 -> 126, size-2864 121 -> 92, size-1000 45 -> 34, fuzz-08 85 -> 63, size-250 14 -> 12)","profile":"instrumented build, cpu_thread clock summed over 5000 files: tokenize 769ms, parse 1200ms, scope 328ms, rules 359ms, walk 4ms (2657ms total). after the change parse falls to 445ms and the total to 1945ms (-27% CPU), against a 186 -> 143ms wall","profile_note":"the profile explains why this is a CPU-bound change and not an I/O one: 5000 files x 3KB is 15MB, and the walk that reads every path is 4ms, so only a front-end reduction can move the wall","safety":"parseTokens is the same lexer and the same Parser: tokenize() then parseTokens() produces the tree parse() did, because the internal tokenize was the identical call with stop=.end_of_input. parse() is now a two-line wrapper over it, so the existing callers and tests keep their signature","verification":"zig build test, test-e2e.sh 125, and the full .auto/checks.sh chain, including native-diff.sh and hygiene-diff.sh which compare every finding against biome's plugin and built-in engines, so a tree that changed would fail the diff rather than pass silently"}}
{"run":21,"commit":"fe22e79","metric":979,"metrics":{"biome_ms":24624,"check_fuzz_08":56,"check_size_100":8,"check_size_1000":29,"check_size_5000":104,"check_sleepy":3,"overhead_ms":0},"status":"keep","description":"dispatch punctuation by its first byte instead of scanning the 60-entry operator table. check_ms 1195 -> 979 (1.22x); the lexer's share of the front-end CPU fell 769ms -> 230ms on 5000 files, and a new test pins all 59 operators at their longest form","timestamp":1789165706470,"segment":2,"confidence":1.5025977577249112,"asi":{"hypothesis":"the lexer's matchPunctuation walked the whole 60-entry operator table in order for every punctuation byte, so a `)` or `,` paid ~50 mem.eql calls before the single-char default. first-byte dispatch is equivalent and much shorter","invalidated_discard":"this is the operator rewrite from run 15, discarded then because it measured -7ms over 30 repos. what changed is not the code but where the time goes: run 15's scan CPU was hidden under biome's subprocess, so no scan rewrite could move the metric. now the scan is the whole run, and the same rewrite pays","measurements":"check_ms 1195 -> 979 (1.22x). per repo: size-5000 144 -> 104, size-3900 111 -> 91, size-2864 86 -> 69, size-1000 34 -> 29, fuzz-08 64 -> 56. instrumented build over 5000 files: tokenize 769ms -> 230ms of CPU (-70%), the whole front-end 1945ms -> 1360ms","profile_method":"a copied tree with cpu_thread clock accumulators around tokenize, parse, scope and rule dispatch, printed to stderr. this is the measurement that run 15 lacked: it shows the lexer at 40% of front-end CPU, which makes the table scan the single largest reducible item before this change","safety":"the switch is the table expressed per first byte with the multi-byte forms longest first, and the table's order already broke ties that way. a unit test now tokenizes all 59 operators and asserts each stays one token, which is the check run 15's version never carried","verification":"zig build test 119 (the new operator test plus the existing distinctness and line-tracking tests), test-e2e.sh 125, and the full .auto/checks.sh chain including native-diff.sh and hygiene-diff.sh, which compare every finding against biome's engines and would catch a token stream that changed"}}
{"run":22,"commit":"fe22e79","metric":949,"metrics":{"biome_ms":25028,"check_fuzz_08":49,"check_size_100":7,"check_size_1000":27,"check_size_5000":114,"check_sleepy":3,"overhead_ms":0},"status":"keep","description":"precompute the tree walk order once per file instead of forcing each of the seven tree-walking consumers to follow links: a full walk through the node list cost 20ns per node, and the rules and the scope pass together paid it seven times. check_ms 979 -> 949, paired A/B 1.043x","timestamp":1789167751586,"segment":2,"confidence":1.5247899547594868,"asi":{"hypothesis":"seven consumers walked the tree by chasing first_child / next_sibling links through 80-byte nodes, so every node visit was a dependent load. build the walk order once per file and let them scan it","measurements":"check_ms 979 -> 949 (1.03x), paired interleaved A/B over 8 repos: 1.043x, uniform (1.00x-1.08x, and 6 of 8 repos at 1.04x or better). size-5000 116 -> 112ms, size-2864 69 -> 66, fuzz-08 56 -> 52","profile_method":"a variant that walked the tree five times with `iterator()` and touched each node's kind, added to the worker loop and timed with the wall clock: 160ms of worker time over 5000 files, i.e. 32ms per full walk, 6.4us per file, 20ns per node. that is the cost being removed","no_semantic_change":"the walk is exactly `iterator()`'s order, and its length is exactly the node count (asserted), so a rule that depends on order sees the same order and `dirty` can stay indexed by node index. no rule's condition or message changed, which is why native-diff and hygiene-diff still match biome byte for byte","shape":"ir.WalkEntry{index, kind} plus ir.Module.walkOrder allocates nodes.len entries and fills them in one iterator pass; the engine builds it when the tree exists and hands it to the rules through Context.walk and to scope.analyze. `hasUnknown` replaces hygiene's separate unknownCount walk","verification":"zig build test 119 including the parse sweep over 44,254 files, test-e2e.sh 125, native-diff.sh and hygiene-diff.sh (both differential against biome's plugin and built-in engines), and the full .auto/checks.sh chain"}}
{"run":23,"commit":"fe22e79","metric":924,"metrics":{"biome_ms":25155,"check_fuzz_08":51,"check_size_100":7,"check_size_1000":28,"check_size_5000":101,"check_sleepy":2,"overhead_ms":0},"status":"keep","description":"replace the parser's per-token operator set scans with a length-and-first-byte test: the expression loop asked a 25-entry string set about every token it met. check_ms 949 -> 924, paired A/B 1.026x","timestamp":1789168087323,"segment":2,"confidence":1.5470956879618372,"asi":{"hypothesis":"the expression loop asked `contains(&binary_operators, ...)` and `contains(&assignment_operators, ...)` for every token it met, each a scan of a 25- and 16-entry string set. a length-and-first-byte test answers the same question in one or two comparisons","measurements":"check_ms 949 -> 924 (1.03x). paired interleaved A/B over 8 repos against the same binary without the change: 1.026x, every repo equal or better (size-5000 112 -> 108, size-2864 68 -> 66, fuzz-08 51 -> 50, the two smallest repos tied)","equivalence":"the two sets are reproduced exactly, including the pairs a first-byte test can get wrong: `<<` vs `<=`, `>>` vs `>=` vs `>>=`, `**` vs `*=`, `??` vs `?.` vs `?`, and the words `in` / `instanceof`. `parse` and the whole suite are unchanged in behaviour, which the differential harnesses confirm","verification":"zig build test 119 including the 44,254-file parse sweep (a wrong operator would desync the parse and show up as unknown nodes), test-e2e.sh 125, native-diff.sh, hygiene-diff.sh, biome guards, full .auto/checks.sh chain","what_was_measured_not_kept":"a companion rewrite of skipType/matchingParen/hasArrowAfter (the parser's bracket scans, ~110ms of single-core CPU between them) also measured positive but the wall gain is inside this change's noise, and the hand-rolled token classification needs three exactness fixes (`>` vs `>>=`, `==` vs `=>`) that make it a poor trade for the size of the win. it is saved at /tmp/scanner-fast.patch if the parse ever becomes the critical path"}}
{"run":24,"commit":"fe22e79","metric":896,"metrics":{"biome_ms":24830,"check_fuzz_08":51,"check_size_100":7,"check_size_1000":25,"check_size_5000":110,"check_sleepy":2,"overhead_ms":0},"status":"keep","description":"dispatch the parser's bracket scans (skipType, matchingParen, hasArrowAfter) on the token's first byte instead of a chain of string comparisons. check_ms 924 -> 896; paired A/B over 8 repos 1.067x including the operator test","timestamp":1789168449155,"segment":2,"confidence":1.6617020209618374,"asi":{"hypothesis":"the parser's three bracket scans (skipType, matchingParen, hasArrowAfter) compared every token against a chain of `isPunct` string tests. first-byte dispatch answers the same question in one or two comparisons","invalidated_discard":"run 15 measured a version of this as neutral, and an earlier cut of this session measured 1.042x then fell to 1.016x after three exactness fixes were added. what changed since: the walk-order change cut the rules phase by two thirds, which makes the parse the largest phase (34% of the front-end CPU, 234ms per 5000 files on one core) and the bracket scans a third of it, so the same rewrite is now worth more than it was","measurements":"check_ms 924 -> 896 (1.03x). paired interleaved A/B over 8 repos against a binary without either parse change: 1.067x uniform (1.02x-1.11x). the operator test alone was 1.026x of that, so the three scans are ~1.04x","exactness":"`isTypeStop` reproduces the 21-entry terminator set by first byte and length (`,`, `;`, `:`, `?`, `+`, `-`, `*`, `/`, `%`, `~`, `^` exact; `=` and `!` up to length 3; `&&` and `||` exactly two; `{` only where the brace starts a body). `angleClosers` spells out all six `>`-forms in a length switch, because a hand-rolled test got `>>=` and a lone `>` wrong while writing it, and `hasArrowAfter` distinguishes `=>` from `==`","not_claimed":"the wall number moved by less than the CPU number in an earlier cut, so the paired test is the evidence and the harness sample is the record","verification":"zig build test 119 including the 44,254-file parse sweep (a mis-classified token desyncs the parse and shows up as unknown nodes), test-e2e.sh 125, native-diff.sh and hygiene-diff.sh against biome's engines, and the full .auto/checks.sh chain"}}
{"run":25,"commit":"fe22e79","metric":738,"metrics":{"biome_ms":23493,"check_fuzz_08":36,"check_size_100":8,"check_size_1000":22,"check_size_5000":78,"check_sleepy":2,"overhead_ms":0},"status":"keep","description":"run the pre-pass's per-surface file work on a flat worker queue instead of one file at a time. check_ms 896 -> 738 (1.21x); paired interleaved A/B over 30 repos 1.177x, 1.22x-1.26x on every repo over 1000 files","timestamp":1789181052682,"segment":2,"confidence":1.8082162162162163,"asi":{"hypothesis":"the pre-pass (src/prepass.zig) is the last serial walk: for each surface it opens every file, extracts imports and resolves them one file at a time, on one thread, while the lint scan next to it holds 16. the files of a surface are independent, so a flat worker queue over them should hide most of the pre-pass under the scan, the way the scan already is","measurements":"check_ms 896 -> 738 (1.21x). paired interleaved A/B over 30 repos (PASSES=3, both binaries alternating per repo): 1.177x total, uniform on the repos that have work: size-5000 107 -> 85, size-3900 85 -> 68, size-2864 60 -> 49, size-1050 45 -> 29, fuzz-08 47 -> 39, fuzz-12 42 -> 34. the repos <=250 files are flat or 1ms slower (thread spawn), which is why the parallel path is gated at 64 files per surface","shape":"SurfaceFile{relative_path, basename, suffix_violation} collected by one walk per surface (the walker's slice is reused, so both names are copied). then either the sequential path (per-file arena reset) or, past parallel_min_files=64, a flat queue: SurfaceBatch with an atomic counter, one result slot per file index, findings built with smp_allocator from a per-worker arena and copied into the caller's allocator at the merge. 8 workers max, because the pre-pass runs beside the 16-worker scan and should take a slice of the machine","output_order":"findings are merged in walk order, so the output does not depend on worker count. one order bug surfaced while validating and is fixed: the 'surface contains only N file(s)' leaf finding was emitted before the surface's files in the first cut, where the sequential walker emitted it after. it now goes through reportSingleton(), which runs after both paths and is the only place that message is built","verification":"byte-identical output against the unparallelised binary on all 30 bench repos, plus a purpose-built corpus with >64 files in one surface and a suffix violation, a firewall violation and a leaf surface in it (/tmp/prepass-check). zig build test, test-e2e.sh 125, native-diff.sh, hygiene-diff.sh and the two biome guards all pass","harness_note":"the pre-commit husky hook runs the full 125-check e2e suite (~100s) and the harness kills git commit at 10s, so keeps land staged in the index and never become commits on this repo. discards are unaffected because git checkout -- . restores from the index. this is why runs 20-24 all report the same commit hash"}}
{"run":26,"commit":"fe22e79","metric":670,"metrics":{"biome_ms":23819,"check_fuzz_08":33,"check_size_100":7,"check_size_1000":20,"check_size_5000":70,"check_sleepy":2,"overhead_ms":0},"status":"keep","description":"defer the lexer's regex-vs-division decision until a `/` or `<` actually needs it. check_ms 738 -> 670 (1.10x); profiled canEndExpression at 13.7% of a run, all but a handful of calls avoidable","timestamp":1789181570475,"segment":2,"confidence":2.923237597911227,"asi":{"hypothesis":"the lexer answered \"does / start a regex\" for every word and punctuation token, because the answer depends on that token's text. a callgrind profile of repo-size-250 put canEndExpression at 13.7% of the whole run (2.13M mem.eql calls, ~19 per identifier because the function scans a 5-entry closer list and a 14-entry keyword list linearly). only a / or < ever reads the answer","measurements":"check_ms 738 -> 670 (1.10x). paired interleaved A/B over 30 repos (PASSES=3): 1.087x total, 1.11x-1.17x on size-500/2864/3900/5000, 1.04x-1.11x on the fuzz repos, flat on repos under 250 files where process start dominates","shape":"regex_allowed: bool became regex_state: RegexState = .allowed | .disallowed | .deferred. a word or punctuation token sets .deferred and the answer is computed on the first read, then remembered. the JSX fallback's save/restore of the flag copies the enum as before, so a nested lex cannot leave a stale deferral","equivalence":"the state machine is the same one: string/number/regex/template_end/} still force .disallowed, ${ and the JSX { containers still force .allowed, and a template literal still leaves the state untouched (the deferral survives it, exactly as the eager bool did). byte-identical output on all 30 bench repos, sleepy and the prepass corpus","profile_method":"valgrind --tool=callgrind on repo-size-250, read with callgrind_annotate --inclusive=yes. the top of the program was mem.eql 28.7% and memset 9.8%, with canEndExpression the largest single mem.eql caller at 8.8% plus 4.9% of its own","next":"isNonReference (5.5% inclusive, a 53-entry linear scan called ~3400x per file) and the scope pass's hash maps (10.7% inclusive) are the next two items on the same profile","verification":"zig build test 119/119 including the 44,254-file parse sweep and the tokenize tests that pin regex-vs-division, test-e2e.sh, native-diff.sh, hygiene-diff.sh and both biome guards"}}
{"run":27,"commit":"fe22e79","metric":638,"metrics":{"biome_ms":23881,"check_fuzz_08":30,"check_size_100":7,"check_size_1000":21,"check_size_5000":65,"check_sleepy":2,"overhead_ms":0},"status":"keep","description":"inline the parser's token comparisons and answer one-character punctuation from the byte instead of a std.mem.eql call. check_ms 670 -> 638 (1.05x); paired A/B 1.053x over 30 repos","timestamp":1789181882064,"segment":2,"confidence":9.270523415977962,"asi":{"hypothesis":"the parser and the rules asked `is this token the punctuation X` and `is this token the word Y` through a non-inlined std.mem.eql call, tens of thousands of times per file. a callgrind profile of repo-size-250 had the parser's token comparisons at 8.6% of the whole run and the rules' at 2.9%, because every `(`, `)`, `{`, `}` cost a function call to compare one byte","measurements":"check_ms 670 -> 638 (1.05x, second sample). paired interleaved A/B over 30 repos (PASSES=3): 1.053x total, size-5000 74 -> 65, size-3900 1.11x, uniform on the mid-size repos, flat on the repos under 250 files","noise_note":"the first `measure.sh` after this change read 737ms, above the 670 it was built on, and a second read gave 638. the two samples disagree because size-3900 read 81ms against a paired median of ~50 and fuzz-16 read 55 against ~31; the paired A/B is the evidence, the second harness sample is the record","shape":"Token.isWord and Token.isPunct are now `inline` and answer a one-character needle from the length and the byte, which is every punctuation the parser asks about except `==`, `=>`, `&&` and the bracket scans. Parser.peek, atEnd, atWord and atPunct are inline too, so the `?Token` copy and the comparison fold into the caller","profile_method":"callgrind on repo-size-250, program total 418.5M Ir before the previous change and 359.4M after it; mem.eql was still 23.2% there, with parseParameterList (4.9%), isNonReference (4.0%), scope.analyze (3.5%) and parsePostfix (3.2%) the largest callers","next":"isNonReference scans a 53-entry keyword array linearly for every word token in an argument list (839k mem.eql calls on 250 files until this change reaches it) and is now the largest single mem.eql caller in the parser","verification":"zig build test 119/119 including the 44,254-file parse sweep, byte-identical output on the bench repos, sleepy and the prepass corpus, plus test-e2e.sh, native-diff.sh, hygiene-diff.sh and both biome guards"}}
{"run":28,"commit":"fe22e79","metric":613,"metrics":{"biome_ms":24244,"check_fuzz_08":30,"check_size_100":7,"check_size_1000":22,"check_size_5000":60,"check_sleepy":2,"overhead_ms":0},"status":"keep","description":"answer literal-set membership from the length and first byte before calling std.mem.eql, so a keyword lookup stops walking 53 candidates. check_ms 638 -> 613 (1.04x); paired A/B 1.064x","timestamp":1789182063175,"segment":2,"confidence":9.95333727111636,"asi":{"hypothesis":"`contains(set, text)` walked a small literal set with one std.mem.eql per candidate, so a word token paid 53 calls (the keyword set) and a punctuation token paid up to 21 (the type-terminator sets). callgrind put isNonReference alone at 4.05% of a run with 839k mem.eql calls on 250 files","measurements":"check_ms 638 -> 613 (1.04x). paired interleaved A/B over 30 repos (PASSES=3): 1.064x total, size-892 1.17x, size-3900 1.13x, size-766 1.12x, size-56 1.14x, size-5000 1.03x, flat on sleepy and the smallest repos","shape":"the length and the first byte are compared inline before the call, so only a candidate that can still match reaches std.mem.eql, and the function is `inline` so the loop folds into its callers. this reaches every set in the front-end, not just the keyword list: unary_punctuation, unary_keywords, type_argument_punctuation, type_continuation_punct, type_continuation_words and member_modifiers","equivalence":"the pre-checks are strictly weaker than the comparison they guard: a candidate with a different length, or a different first byte when the text is non-empty, could not have been equal. an empty candidate and an empty text still match through std.mem.eql, because the first-byte test only runs when the text is non-empty","verification":"zig build test 119/119 including the 44,254-file parse sweep, byte-identical output on the bench repos, sleepy and the prepass corpus, plus test-e2e.sh, native-diff.sh, hygiene-diff.sh and both biome guards","next":"the profile's remaining peaks are memset at 11.6% (zig fills every allocation and every freed block with undefined, even in ReleaseSafe, so the front-end's array growth pays a fill plus a copy) and the scope pass's hash maps at ~10% inclusive"}}
