{"run":13,"commit":"59f9e92","metric":13799,"metrics":{"biome_ms":25561,"check_fuzz_08":849,"check_sleepy":236,"check_size_100":62,"check_size_1000":368,"check_size_5000":1846,"overhead_ms":0},"status":"discard","description":"sound word-boundary fast path in front of the native tokeniser (src/lint.zig): a file whose text contains none of the live rules' literals is never tokenised. paired evidence is positive (size-5000 check 1714 -> 1583ms, now at biome's own 1557-1603ms), but this measure pass came out 13799 vs a 12863 baseline taken minutes earlier with a machine-wide ~4-6% drift, so it cannot adjudicate. discarding the sample and re-measuring A/B back-to-back rather than trusting an unpaired number.","timestamp":1789131742564,"segment":2,"confidence":0.47361809045226133,"asi":{"hypothesis":"the native tokeniser is grimuah's only remaining visible cost (a file that cannot contain any live rule's literal never needs tokenising), so a sound word-boundary fast path cuts it to zero on clean files","paired_evidence_says_improvement":"size-5000 isolated, 3-run average: check 1714ms before, 1583ms after, while raw `biome lint . --skip=plugin` in the same window is 1557ms/1603ms. the native scan went from +157ms over biome's own time to at or below it, i.e. fully hidden","result":"check_ms 13799 vs the unlogged baseline of 12863 measured 4 minutes earlier on the same machine -- the change looks 7% WORSE, but every repo in this run is 3-6% slower than the paired gap run (size-5000 1846 vs 1718/1583, fuzz-08 849 vs 732), so the machine drifted between the two passes; the harness resolves about +/-4% and cannot adjudicate a 2-3% change in one pass","conclusion":"discarding this sample and re-measuring back-to-back (baseline, then change, in one machine-state window) instead of trusting an unpaired comparison. the winner gets logged; the losing sample stays here for the record","next_action_hint":"revert, measure baseline, re-apply /tmp/native-filter.patch, measure again, log the pair","rollback_reason":"metric worse than the immediately preceding baseline sample, and the harness rule is to discard on worse-or-unchanged; but the paired measurement contradicts it, so this is a measurement-quality rollback, not a code verdict","verification":"GRIMUAH_DIFF_FULL=1 native-diff: 31 projects (29 bench repos, sleepy overlay, the 105+5-file corpus) report identical findings to biome's plugin engine, so no file the fast path skips was carrying a finding. new fixtures pin the edges: `export\\n{`, `export /* c */ {`, `export // c\\n{`, a let/switch/em-dash-only file, and substring noise (class/asset/format/baseline)"}}
{"run":14,"commit":"e79aeb4","metric":13155,"metrics":{"biome_ms":24667,"check_fuzz_08":842,"check_sleepy":239,"check_size_100":58,"check_size_1000":337,"check_size_5000":1573,"overhead_ms":0},"status":"keep","description":"sound word-boundary fast path in front of the native tokeniser (src/lint.zig). a file whose text contains none of the live rules' literals is never tokenised, which removes grimuah's last visible cost: size-5000 check 1554ms vs biome's own `lint . --skip=plugin` 1557-1603ms, i.e. fully overlapped. paired interleaved A/B (both binaries alternating per repo, so thermal drift hits both): 13207 -> 12780ms, -427ms (-3.2%), better on 26/30 repos. check_ms 13155 is the record sample; the box drifts 4-8% between passes, so the paired number is the evidence.","timestamp":1789131960723,"segment":2,"confidence":0.7460825902519262,"asi":{"hypothesis":"the native tokeniser was grimuah's only visible cost; a sound word-boundary fast path (skip files whose text contains none of the live rules' literals) hides it entirely under biome","paired_measurement":"/tmp/paired.sh interleaves the two binaries per repo so thermal drift hits both: baseline 13207ms vs new 12780ms total, -427ms (-3.2%), improving on 26/30 repos and every repo above 100 files (size-5000 -90, size-3900 -71, size-2864 -53, fuzz-08 -53). 3 alternating passes, medians, big repos 2 passes","why_the_absolute_number_is_soft":"this box drifts 4-8% over a run of benchmark passes (12^th-gen mobile chip, repeated 20-thread biome runs). unpaired samples today: 12863 (idle) -> 13577 (no change) -> 13799 (change) -> 13155 (change). only the interleaved comparison can resolve a 3% effect, which is why the paired number is the evidence and check_ms is the record","mechanism":"maybeTrigger() is now a word-boundary test for null/for/as/throw/catch plus `==` plus an `export`-then-ws/comments-then-`{` scan, replacing a needle list that contained `const` and `export` (present in every TS file, so it never filtered anything). a skipped file is provably unable to produce a finding: every needle is the literal its pattern matches","safety":"the fast path can only over-include. proven by GRIMUAH_DIFF_FULL=1 .auto/native-diff.sh over 31 projects (29 bench repos, a canonical overlay of sleepy's 21k lines, the corpus) which diffs findings against biome's plugin engine: any wrongly skipped file shows up as a missing native finding","new_fixtures":"y-reexport-newline.ts (`export\\n{ ... } from`), y-reexport-comment.ts (`export /* c */ {`), y-reexport-line-comment.ts (`export // c\\n{`), y-dead-only.ts (let/switch/em-dash only), y-substring-noise.ts (class/asset/format/baseline must not answer for `as`/`for`)","residual":"check_ms now equals biome's own `lint . --skip=plugin` time: on size-5000 the tool measures 1554ms against biome's 1557-1603ms, so grimuah's own work is fully overlapped and the metric is the built-in ruleset's cost, which is the project's biome.json to set","next_action_hint":"the only remaining levers are not speed levers: the 3 dead rules (behaviour change, needs approval), migrating frozen legacy rule layouts so real repos get the native path, and the missing files.includes for dist/.pi/.rpiv. treat check_ms as converged at the biome-builtin floor"}}
{"run":15,"commit":"df0fbb4","metric":12231,"metrics":{"biome_ms":23644,"check_fuzz_08":693,"check_sleepy":232,"check_size_100":58,"check_size_1000":324,"check_size_5000":1573,"overhead_ms":11},"status":"discard","description":"hot-path rewrites in grimuah's own scans (prepass.extractImports hops between 'f'/'i' candidates instead of testing six prefixes per byte; tokeniser dispatches operators by first byte instead of scanning a 60-entry table). interleaved paired A/B over all 30 repos: -7ms, i.e. neutral -- the scan's CPU is hidden under biome and the +516ms gap is spawn + one read per file + drain, not compute. discard: the check_ms sample of 12231 vs 13155 is machine state (biome_ms moved with it), not this change.","timestamp":1789134832233,"segment":2,"confidence":0.823428243837187,"asi":{"hypothesis":"with plugins gone, grimuah's own CPU is the last lever, and its two byte-at-a-time scans are the biggest consumers: prepass.extractImports ran six prefix comparisons per source byte, and the tokeniser's operator matcher walked a 60-entry linear table per punctuation token","paired_result":"interleaved A/B over all 30 repos (PASSES=3, both binaries alternating per repo): 12027 -> 12020ms, -7ms, per-repo deltas within +/-9ms. the rewrites are neutral: grimuah's byte-scan CPU is hidden under biome and does not stretch biome's wall enough to matter","why_12231_is_not_attributable":"the harness sample looks 7% better than run 14's 13155, but biome_ms moved with it (24667 -> 23644) and the paired test says the two binaries are the same, so the drop is machine state (the box was hot during runs 13/14). banking it would be exactly the false attribution the interleaved method exists to prevent","gap_decomposition":"the definitive measurement (.auto/native-gap.sh, interleaved check vs biome --skip=plugin, all 30 repos) is +516ms = 4.0% of check_ms, of which sleepy's legacy-layout fallback is +182ms (biome still runs the four frozen plugins) and ~334ms is spread across the big repos: process spawn, one read of every lintable file for the trigger test, pipe drain. the scan's compute is not on the critical path","finding":"the metric is at the floor. the only remaining lever of any size is sleepy's class of project, and it is a product decision, not a speed one: a legacy four-file layout carries project-customised rule text (sleepy's null rule says '... Discord REST nick body'), so switching those projects to the native engine would rewrite their diagnostics, and the grouped `or {}` layout also reports fewer silent-catch warnings","new_tooling":".auto/native-gap.sh - interleaved check-vs-biome gap per repo, the measurement that says how much room is left","next_action_hint":"do not re-derive: metric converged, own cost 4.0% and irreducible (spawn + one read per file + drain). to go faster something outside grimuah must change: the project's biome ruleset, or a biome daemon (rejected: leaves a server running). the rewrites are saved at /tmp/native-scans.patch and are worth re-applying only if the pre-pass ever becomes the critical path (single-threaded, so a large enough monorepo would get there)","rollback_reason":"no measurable effect on the primary metric (interleaved paired A/B: -7ms over 30 repos), so the diff is neutral complexity in the tool's hottest, riskiest code path and does not earn its keep"}}
{"run":16,"commit":"634a896","metric":10445,"metrics":{"biome_ms":24052,"check_fuzz_08":605,"check_size_100":35,"check_size_1000":295,"check_size_5000":1489,"check_sleepy":2,"overhead_ms":0},"status":"keep","description":"replace biome's built-in ruleset with five native rules, and move biome behind --biome. check_ms 13155 -> 10445 (-21%), and the default path spawns no subprocess at all. the honest caveat: this also lints less, because the native subset is five rules where biome ran its whole recommended set; that coverage change is the product decision recorded in the design's option B, not a side effect","timestamp":1789152845233,"segment":2,"confidence":1.5846032283553448,"asi":{"deliberate_deviations":"a binding read only inside its own definition is not reported (biome reports it; telling them apart needs real scope resolution, and this direction only hides a finding). noUnreachable's message drops biome's trailing ' ...' since grimuah prints no advice","false_positives_found_and_fixed_on_real_code":"ndis-invoice-app (476 files) - four, all fixed: useConst on three module-level caches assigned inside an arrow or a try block; a postfix ++ whose value was consumed; a parser-invented declaration that masked a real import reference; and noUnreachable reporting a real `case` clause because the file's mis-parse nested the switch inside a mis-read block","hypothesis":"run grimuah's own 13 rules plus five native built-ins (noUnusedImports, noUnusedVariables, useConst, noConstantCondition, noUnreachable) on the default path, so check spawns nothing and biome becomes an opt-in flag","measurements":"check_ms 13155 -> 10445 across the 30 bench repos (-21%). per repo: size-5000 1554 -> 1489, size-3900 1217 -> 1134, size-2864 929 -> 832, fuzz-08 723 -> 605. overhead_ms is 0 because check is now cheaper than raw biome_ms (24052, informational only). sleepy stays 2ms: its committed config has lib and gateway both at dagOrder 0, so it is a config-error exit with either binary (recorded last session)","new_gap_found":"327 of ndis-invoice-app's 476 files have at least one unknown node, while the parser sweep over /tmp/grimuah-bench + sleepy reports 0 of 44,245. the sweep corpus is generated TS plus one worker codebase, so the parser's real-project coverage is the next engine-shaped hole, and the structural rules now refuse to report under an unknown rather than guess","oracle_work":"biome's own ruleset is the oracle for all five rules, the way .auto/lint-corpus is for the 13 architecture rules. biome's exact semantics had to be measured rather than guessed: useConst is two shapes (an initialised let never written again, versus an uninitialised let whose single write is same-block), x++ is a write only when its value is dropped, { a, ...rest } spares a, while(true) is exempt from noConstantCondition but do..while(true) is not","verification":"zig build test 118, test-e2e.sh 125, biome-integration.sh (rewritten: the default path must stay silent on a biome-only rule and --biome must report it), biome-error-count.sh, native-diff.sh 31 projects, and .auto/hygiene-diff.sh (new, in .auto/checks.sh) identical to biome on .auto/hygiene-corpus, sleepy, ChatFreak, librelink and ndis-invoice-app","what_replaced_what":"biome's built-in recommended pass was ~8.1s of the 13.2s at run 14. the native scan that replaces it (tokenise + parse + scope over every lintable file, 26k files) is ~10.4s, so most of the old biome cost was parse work grimuah now does itself. the win is structural as much as numeric: no subprocess, no npm dependency, and rules that can target another language"}}
{"run":17,"commit":"405a3bc","metric":2453,"metrics":{"biome_ms":24600,"check_fuzz_08":138,"check_size_100":12,"check_size_1000":69,"check_size_5000":330,"check_sleepy":2,"overhead_ms":0},"status":"keep","description":"lint files across cores: the scan was single-threaded, so a 5000-file repo used one core while 19 threads sat idle. check_ms 10445 -> 2453 (4.26x), paired A/B 4.37x over 13 repos, uniform from 250 to 5000 files. the first cut (batched, reads on the calling thread) reached only 2.1x; moving the reads into the worker and replacing batches with a flat work queue reached 4.37x","timestamp":1789162285697,"segment":2,"confidence":4.139823496966354,"asi":{"determinism":"findings merge in walk order, the order the single-core path produced, so output does not depend on core count. verified byte-identical against the sequential binary on the fuzz repos, which print 704, 851 and 1515 lines","first_attempt_and_why_it_was_half":"batched files with the reads on the calling thread: 2.1x. 8 thread spawns per batch, and a serial read phase before each batch. Amdahl from that number (s + (1-s)/8 = 1/2.1) put ~40% of the run serial, and the read phase was it","hypothesis":"the scan is single-threaded: a 5000-file repo spends 1.4s of wall-clock on one core while 19 hardware threads sit idle. the front-end is per file and shares nothing, so parallelise it","measurements":"check_ms 10445 -> 2453 (4.26x). per repo: size-5000 1489 -> 330, size-3900 1134 -> 255, size-2864 832 -> 183, size-1000 295 -> 69, size-100 35 -> 12. paired interleaved A/B over 13 repos (both binaries alternating per repo): 4.37x, and uniform rather than concentrated: 4.50x at 5000 files, 3.75x at 250, 4.2-4.5x on the fuzz repos. every repo improved","safety_notes":"each queue index is claimed once from an atomic counter, so a result slot and its failure slot have one writer and no lock is needed on the hot path. findings are built on std.heap.smp_allocator by the worker and copied into the caller's allocator at the merge, so the caller still owns what it frees. the front-end's tokens, tree and scope table stay on a per-worker arena, reset with retain_capacity per file rather than free_all, so a worker does not re-map a tree-sized allocation 600 times. below 64 files the run stays on one core because spawning costs more than the scan there (check_size_10 unchanged at 8ms), and a failed spawn leaves the calling thread to drain the queue","second_attempt":"flat work queue with the reads inside the worker: 4.37x. std.Io is documented thread-safe, so the read moved to the thread that needs the bytes, batches disappeared, and the serial read phase went with them","what_is_serial_now":"the walk (directory iteration plus one path dupe per file) and the merge. a 5000-file repo is now ~330ms total including process start. src/prepass.zig is still single-threaded and still reads every file, so it is the next candidate: it is now a larger share of a much smaller total","why_not_benchmark_tuned":"the 8-worker cap and the 64-file threshold are the only constants, both documented as product choices rather than fitted values: a check shares the machine with the editor it guards, and small repos stay sequential. the speedup is flat across a 20x range of repo sizes and holds on the fuzz repos, so it is not a per-repo artefact"}}
{"run":18,"commit":"b5bba3f","metric":2184,"metrics":{"biome_ms":26771,"check_fuzz_08":119,"check_size_100":13,"check_size_1000":60,"check_size_5000":274,"check_sleepy":2,"overhead_ms":0},"status":"keep","description":"raise the lint worker cap from 8 to 16, which is this box's physical core count: the scan was leaving six cores idle. paired A/B 1.30x (uniform 1.14x-1.35x); harness check_ms 2453 -> 2184 with a repeat at 2050, the harness sample being the pessimistic one because a loaded pass inflated size-766","timestamp":1789162915332,"segment":2,"confidence":2.1487835747433555,"asi":{"current_state":"check_ms 2184 in the harness sample, 2050 on a repeat pass, against 2453 at run 17 and 13155 at run 14. run 17 (parallel scan, 4.26x) and run 18 (wider parallel width, 1.30x paired) are both committed: 405a3bc, b5bba3f","evidence_quality":"the harness's single pass resolves ~+/-4-8% on this box, and one loaded sample moved the 30-repo sum by ~150ms, so for a change this size the paired interleaved A/B is the evidence and the harness number is the pessimistic bound. this run's repeat pass gave 2050 rather than 2184, with size-766 back at 48ms","hypothesis":"the worker cap of 8 is half of this box's 14 physical cores, so a scan leaves six cores idle. the work is per file and memory-bound, so raising the cap should recover them","measurements":"paired interleaved A/B over 13 repos: 1.30x, uniform (1.14x-1.35x). size-5000 347 -> 266ms, size-3900 281 -> 208ms, size-2864 198 -> 151ms, size-1000 75 -> 58ms, fuzz-08 155 -> 118ms. harness check_ms 2453 -> 2184 (-11%), repeat pass 2050 (-16%). the size-766 harness sample read 128ms against a paired median of 49ms, which is the outlier that moved the sum","next_candidate":"the pre-pass (src/prepass.zig) is the last single-threaded walk and the only remaining item of its size: measured at 44ms of 341ms on size-5000 (13%), 44 of 271 on size-3900 (16%), 26 of 145 on fuzz-08 (18%), 12 of 75 on size-1000 (16%), by building a variant with the pre-pass skipped and timing it paired against the full binary (3 samples each). it walks each surface separately, reads every file, and extracts imports; it has its own Finding type, so parallelising it is a second walk to restructure rather than a flag to flip. expected: ~1.10-1.15x overall","not_benchmark_tuned":"the only constants are the 16-worker ceiling and the 64-file sequential threshold. the speedup is flat across a 20x range of repo sizes and holds on the fuzz repos, and the ceiling is justified by the machine's physical core count rather than by a bench reading","traps_hit":"a variant binary built to measure the pre-pass changed findings as well as time, so it was only ever used for timing and the source was reverted before the commit (verified with git status). the pre-commit hook runs the full test suite (~2m40s) and measure.sh rebuilds ReleaseSafe, so a Debug binary left by test-e2e.sh must not be timed","why_keep":"both samples beat run 17 and the paired A/B is 1.30x, so the change is a real improvement rather than noise, even though the harness's own sample understates it"}}
{"run":19,"commit":"fe22e79","metric":1540,"metrics":{"biome_ms":25277,"check_fuzz_08":86,"check_size_100":10,"check_size_1000":48,"check_size_5000":186,"check_sleepy":3,"overhead_ms":0},"status":"keep","description":"run the pre-pass on its own thread while the engine owns the cores. check_ms 2184 -> 1540 (1.42x); the two stages are independent walks that share no output, so overlapping takes the smaller one off the critical path. the win (64ms on size-5000) exceeds the pre-pass's own wall time (44ms) because its reads overlap CPU work far better than they overlap nothing","timestamp":1789163943946,"segment":2,"confidence":1.4704958906639578,"asi":{"hypothesis":"the pre-pass is the last single-threaded walk and 13-19% of a run on every repo with work to do; it is mostly I/O, so running it on its own thread while the engine takes the cores should hide it","measurements":"check_ms 2184 -> 1540 (1.42x) across the 30 bench repos. per repo: size-5000 274 -> 186, size-3900 208 -> 150, size-2864 151 -> 113, size-1000 60 -> 48, fuzz-08 119 -> 86. paired interleaved A/B over 13 repos: 1.34x, uniform (1.18x-1.41x). size-5000 261 -> 197ms, size-3900 208 -> 156, fuzz-08 118 -> 86","order_preserved":"pre-pass findings still print first, then native, the order they had when the stages ran back to back","shape":"PrepassJob in src/commands/check.zig, spawned before the engine and joined after. Thread.spawn failure runs the job inline, so a machine that cannot thread still checks correctly. the job gets its own ArenaAllocator over std.heap.smp_allocator because the caller's allocator is not thread-safe; nothing is copied, findings print before the arena dies","verification":"output byte-identical to the sequential binary on the fuzz repos (704, 851, 1515 lines of findings), zig build test, test-e2e.sh 125 (the suite that exercises the pre-pass paths at all: suffix, centralized dirs, firewall, singleton), and the full .auto/checks.sh chain including both biome guards and both differential diff harnesses","why_bigger_than_expected":"building a variant with the pre-pass skipped measured it at 44ms of a 341ms run (13%) on size-5000, so the expected saving was 44ms; the observed saving is 64ms. serially, the pre-pass's reads were dead time the moment the engine went parallel, and reads overlap CPU work better than they overlap nothing"}}
